{
  "$schema": "https://gpui.rs/registry-item.schema.json",
  "name": "button",
  "type": "registry:ui",
  "description": "A customizable application-owned button component.",
  "dependencies": ["gpui-component-base"],
  "registryDependencies": [],
  "files": [
    {
      "path": "ui/button.rs",
      "type": "registry:ui",
      "target": "src/ui/button.rs"
    }
  ]
}
