{
  "$schema": "https://gpui.rs/registry-item.schema.json",
  "name": "radio",
  "type": "registry:ui",
  "description": "An application-owned radio presentation.",
  "dependencies": ["gpui-component-base"],
  "registryDependencies": [],
  "files": [
    {
      "path": "ui/radio.rs",
      "type": "registry:ui",
      "target": "src/ui/radio.rs"
    }
  ]
}
